text,pred_label
you can give all sought of your family foods in the form of paste and smoothies   meals should be 34 slowly increasing to 45 times a day   breastmilk should be supplemental and no other milk should be given   keep quantity which is filling your babys tummy in one meal   ,0
sankari k das thanks i will defntly try,0
my 11 month old son doesnt chew much    i have to crush everything  feed him   is there any solution to it,1
cyrup or tablets are available at medical store  brought according to childs age or can visit doctor they can give better  d warming must b done at every 6 months  ,0
do some floor exercise,0
yes      veg soup      if u eat non veg then u can given chicken soup also after 6 mth nd after 7mth egg yolk which is health fr babies,0
hi mommies my baby is 11 months running      her weight is low    doctor said that give everything to her    but she rejects    n also every one hour me feed karne ke liye bola      i have given rice n two types crelac  dalia n oats      our kya kya dedu  pls tell me what should i give every one hour      ,1
mera beta abhi 6 month complete hua abhi me use kuch khane ke liye start kurungi to pls suggest me use first time kya du          ,1
vidhya havnur joshi     yes may be     i agree        see what was the question about and so she or he wrote to ask ping or inbox      ,0
hlo moms                   baby ko move lga sakte h ja nahi   swelling sr pr hui h        pls koi home remedie btao pls admin          post my note  hello moms                   i can move baby   i am not able to move         please tell me any home   please tell me admin           post my note    rate this translation,1
hello mummies       my girl is 5 month old n she is suffering from cold and cough       kindly share some home remedies to cure cold n cough         waiting for ur suggestions       i m giving her wikoryl and kofarestpd      ,1
important for mother of a girl child pls take care when u clean ur babys potty   dont touch babys urinary area it cause urine infection         pls contact ur doctor ask abt details,0
hello mommies mujhe thyriod aaya h 8  600   my baby 5 months old h    kya mujhe feed krana chahiye ya nhi      ,1
my baby boy is 3month old    merko apne baby ka birth certificate me naam change krvana h    if anyone know the process of naam change plz tell me   i m so worried     plz plz,1
yes very stressful nd tiring kaam aur bache ko sambhalna is very tiresome job,0
plz suggest food to increase haemoglobin for 1 yr baby gal  ty in advance  ,1
my 3  5 yrs   daughter suffering from mouth ulcers   plz suggest any home remedies or medicine  ,1
take injection which is valid for 3 months,0
my baby is 1 year old but i never apply powder to her till now    ,1
hahahaha wht an idea sir,0
nasal drps use karne se kya hota hai      ,0
hi friends      my baby is 4 month old   after one month of delivery i m gaining too much wait suddenly   is it normal   n what should i do for loosing weight      ,1
make a slice n rub it on a dark place twice or thrice a day itz will help skin to lighten up,0
khaskhas   sukha coconut alsi do usase bm badhega kyuki abhi mother milk hi acha hey usko growth me liye aur health ke liye,0
hello everyone    when at what age age should i start teaching second language to my toddler,1
any idea from where to buy the cot    as i am preparing the room for my baby who is about to come next month  ,0
she feels restless since the feces is still there in her tummy   i think you should see a doctor immediately   once he solves this problem   then you can stick to home remedies to make her pass motion every day  ,1
any home remedy for cold and cough,0
what should be feed at time of festivals for my 1 year old baby,1
plz guys help me main tenshion se pagal ho jaungi mere baby ko pichle 5 days se fever chl raha hai ache se kha pee bhi nai raha bht preshan hun plz plz plz help me kya kru ki vo thk ho jae he is 9 month old doctor ko dikhaea antibiotic nd fever ki medicn chl rai hai bt medicn do to fevr thk jaise hi medicn ka asr khtm fever phr se ho jata  plz guys help kro meri plz,1
12 hours a day is enough for 1 year old,1
hi moms baby ko 6months complete hone ke baad kya khilana hair       plz suggest me,1
wait for 1 more month      or if ur milk is not sufficient consult doc n give other food    ,0
give her books to read or read a story to her   they are the best sleeping tablets for kids   ,0
hi frds i am new to this group  i want to loose my belly fat wt to do    i hv 4months baby nd 3yrs one   both r c section delivery  ,0
my child has very dry skin what to do   ,0
helo frndz       mere baby 8 month ka h use ko dadrf hu gai h kya use kro        badam oil ki malish ve krti hu,0
hi i am mother of 3 month old twins  initially i use to breastfeed mostly and top feed occasionally but eventually it gets difficult to do so   then i tried half half method but now breastfeed somehow getting neglected   i am worried   it is quite difficult to breastfeed both   how should i manage   will long gap hamper my supply,1
hi am mother to 7 month old twins   since i joined back to my job my breastmilk has reduced drastically its bcum lk 1015ml a day       plz advice me how to increase supply   ,1
oh i am sorry tou doctor ko contact kro,0
hii frnds plz help 8 mnts bby ko kitni quantity khila skte h jaise banana kitni deni h and other food,1
hi pl suggest me my baby boy 1year complete now but he is under weight  his weight is 7  50  ,1
u can give that if ur baby likes it    i give my baby everything she likes to eat      she is 1 year and 1 month,0
hello moms           my baby is 2 and half years old she is not doing poo for last three days             medicine b di but not working                 is there any remedy             pls suggest             thanks in advance,1
omg  r they doctor or devil  ,0
please dont grind     if ur baby get habits of grind food     after that he will not have other food direct     try to feed ur food in ur way     ur baby will voimit for some days   bt after he will get habits to have like that       after u grind food     all nutrition gone from food   u will feed ur baby only paste     i face this problem till 2  6yr   after 3yr my baby start food by my hand   please think on this,0
hi my son is 2 months      he hv gastric problem     day time its normal but morng he struggle lot to sleep    plz suggest me sum home remedy     he is also under antibiotic due to ear infection    ,1
consult your doctor may be its cause of ellergy,0
its a sign of child taking position   please show your doctor immediately   signs of delivery soon,1
u can use as baby weight,0
green motti saunf ubal kr uska pani do,0
mera baby 1  5 yrs ka h  usko kal raat se fever h med di thik ho gya dobara phir ho gya  kya fever ki med continue kru ya doc ko dikhau          my baby is 1  5 years old  she has been fever from last night   she has become fine again again    will the fever of fever be brought to the crew or the doc            rate this translation,1
hello everyone my boy is 3 years old he is underweight according to his age he is only 9 kg he doesnt take food and anything he feed with bottle only 2 to 3 times what can i do plz suggest me  ,1
hi frnds  my baby is 5 month old   doc ne mujhe use mugli ghutti nd gripe water dene se mna kiya hai and sab kehte hai ki baby ko mugli ghutti nd gripe water do   me kya kru plz advise  ,1
hello   my little one is 2 months old   her year duct in the left side is blocked   she has got the infection four times already   it does get better if i clean the eye and give her massage   but im worried about the frequency of the infection   has this happened to anyone else    how long did it take to see an improvement    tia,1
please show to dr,0
shi h bt coconut oil is best in summer     dabar lal grm hota h,0
both are good but for plastic check for isi mark and the plastic should be virgin plastic      and for wooden blocks although there are natural make sure they should not have any rough surface otherwise it may harm the baby  ,0
hi all moms      can u tellme how to clean kid panis properly nd safely         if u know video pls share wid me      i m confused clean it inside of the foreskin or only outside of panis  i used wipes       is it safe  ,1
may bhi wheat allergy na ho  pls kisi specialist ko check karvayie  ye wheat allergy mai hota hai kabhi kabhi,0
but still happy when i see my baby girl,0
my baby is 2  5 yr old   due to some medical condition he had undergone circumcision    after removing his bandage he is having lot of pain and irritation     what should i do   he is crying soo much,1
hi   im nisha   my son is 16 months old   he had an attack of viral fever since last wednesday   hes okay now   but his food intake has reduced drastically   he hardly eats 23 morsels twice a day   he always wants to breastfeed   im worried   is he getting his nutrition   he is active otherwise   the doctor has also started zinc supplements for hunger but there seems to be no improvement  ,1
akanksha sharma tiwari what a shame     mind ur language ok,0
meri 3 months baby hai bilkul v nai soti   pura din me kabhi kabhi 20 min ya 30 min soti hai    fir raat me 9 bje se se soti hai   pls suggest me ki din me baby ko kaise sulaun,1
can i give kora to 4 month old   if yes   what consistency  ,0
is thr ny mom  whos child is fully on fm       do tht reqlly feel chng in his immunity  ,1
my baby is 2  5 months old      he is not able to latch milk becz of over flow and he cannot manage so he will start crying      pls suggest me thanks in advance      ,1
red colour  children experience red colour when they make their own rooh afza drink and enjoy  children look through red colour cellophane strips and observe the colour of things around them  ,0
7 years ki boy hei mera to use kaunsi health drinks do plz suggest me,1
yes  normal  kyuki hr babies ki growth alg alg hoti h koi jldi krta h to koi lait          dont worry,0
no cow milk until 1 yr   can be used as cooking ingredient though  ,0
hello all    my baby is of 14months and his toe skin is cracking   what to do  ,1
yup but i cant resist that the irony    ,0
i faced same situation  2 missed abortion  tell to first control tsh level  then dr has given hormonal injection  and i deliver healthy baby  trust in god  see good dr,0
i m also mother of twins      mam    ye uski weakness ki vjh se h    mam uska digestion weak h      mam cow milk me use paani warm water mix karke do      means 5  2 ke ratio se 5 spoon milk 2 spoon water,0
mai apne baby ko kab se cerelac start karu abhi wo 2 months 10 days ka h,0
sugar intake is very common in kids   it is important to understand that it may result in many health issues in kids   this expert article explains sugar addiction in babies in detail  ,0
exclusively breast feeding is really good dear       but try to give solid food too       try try      neglect what others saying every child is different       be with ur kid not wid other people    ,0
true i also dont no why        ,0
yes   this oil is very good for babies,0
hello to all  my baby is about to turn 8months on 18june  when can i give her egg  and chicken soup,1
hello friends aaj fir aapki help chahiye m janti hu ki ye is group se related post nhi h fir bhi admin mam plz approve my post it will b a big help of someone              mere ek relative h jinhe pichle 1yr 8mnth se leukoplakia h unke gum pr ek white stain h jo bdta aur km hota rhta h but painless h ab tk ayurvedik treatment le rhe the pr puri trah se nahi gya bs km hota h fir bad jata h wo aur unki puri fmly bhut preshan h sb kr k dekh liya pr koi fayda nhi hua meri aap sb se request h plz aap m se koi is problem k bare m janta ho to btao kya kisi ka thik hua h kya koi acha doctor h aapki nazar m iske liye plz help bhut preshani h unko,1
join this helpful group     breastfeeding support for indian mothers   u will get help,0
my baby is 2  5 yrs old  now he is suffering from typhoid  after consulting the doc  i give antibiotics  now he is free from the temp  but foe excess chill he refuse to take food  he wants to sleep anytime n cries most of the time  pls help me what should i do  i m in a lot of tension  pls help me mommies      ,1
till what age does oil massage need to be done before bath for toddlers   anyone doing oil massage for 23 years old kid   if yes how many days a week do u do oil massage   and which oil do u use  ,1
hi mommies   my son is 18 months i have concern about his behavior some time he doesnt response when we call him hes active but the same time he hardly speak few words is it normal   ,1
he is on both        fm nd bm,0
honey and ginger is very effective   also dabbing 12 drops of eucalyptus oil on the babys clothes helps in breathing and your baby will be able to sleep better,0
hi all moms     pls give some weight gain tips for my twin boy babies     they are 3  5 now    ,1
shambhavi shukla sehgal should i grate cheese n paneer my lo is going to b 8 months on 17,0
hey frnds i m 9 month pregent if doc say baby bladder is full kidney are swollen bcoz baby nt done urine    so is it riseky      ,1
apka kya experience tha 9th month ke vaccination ke bare main,0
give the baby tummy time    apply a bit baby oil in the anus area    do cycling with the legs of the baby    ,0
this is like some insectbite apply some coconut oil   it will get soon,0
curd de skte h 6 month bby ko meri 7 ki ho gyi kese du use curf,0
hi all    in which seasons ragi malt can be given to babies      ,0
yes but start should b in9th month,0
what u mean by feeling    ,0
hello doctor     my little one is 4 months old and cries for milk after every hour   even during sleeping   i breastfeed him and once in the whole day give him formula milk   when should i introduce solids to him and in how much quantity   also   what all can be given to him to eat    ,1
hii mommies  im mother of 1 month baby girl     she is on bm    im suffering with cough      and she is also suffering from cough      vat i need to do    plz suggest    im feeling helpless      ,1
important had kya,0
indu aanshi meei toh isi umeed mei hu jb mere devr ki shadi hgi tb shyd saas humko alg kr de saas ne 3 ghr toh khreede hue h pr bhjti nhi humko       chipki padhi h mujse ptah nhi kya pyar h muje toh ek min nhi rha jata sath,0
yes very true     banana is very good for kids     i give banana whenever my kids ask     morning evening or night,0
how to reduce the belly after c sec   kindly advise,0
drink beetroot juice in empty stomach every morning         it will do wonders in ur haemoglobin level  give it a try for 15 days     u will c d change in count,0
you please do not drink hot coffee or milk,0
agar apne recently abortion karaya hai tho kam se kam apko 6 month with karna chahiye      meri devrani ka bhi yahi hua 1 month 15 days ka miscarriage hua tha       hum sab ne use suggest kiya ki 6 month wait karo       pichle june main ye sab hua tha now she is 7 month pregnant       so ap bhi thora wait kijiye,0
hello moms       my son is sik     and he is 20 months kid   can you please tell me the normal pulse rate and heart beat for sik kids     and he is suffering from cough  ,1
take him for dining etiquette workshop after watching so many kids he will learn a lot  ,0
he is 2 year old,0
my 9 month baby ke hair ma juye ho gayi h kya kru,0
its been 10 months i havent got it       get scared smtime no prob with the body       asked doc many times       thy say its v normal       shld i do sm test,0
hello friends          ragi kya hota ha or market me kha par milta ha or iska babies k liye kya benefit ha plz btaiye moms          thanks,1
may be sum1 in your family is expecting        bhai ya bhen aane wala hota hai,0
hie mothers can l give my 6 months baby sour milk  please helpl,0
dear   avoid sugar oily food    eat green vegetable   n drink atleast 15 glass water   and do some exercise like squat   and skipping i hope now u can understand   still if u hav any doubt so ping me on 9074422853 and drink zeera water wid lemon  ,0
hello momies pls help  my baby is 1 year old       he is pooping several times a day but the thing is that its bot normal poop its just a spot      even when he do susu and farts the little poop came out         is anything to worry  ,1
parle g hv glucose so doctor said no        ,0
i personally feel you should not take such a small baby in such a crowded place   that too its going to be closed n continuous ac      besides loud sound n bright lights       both are not good for baby      n these days   climate is also changing      there cud b a risk of viral or any other infection       why do you want to take such a risk just to please an aunty of yours       who is more important         and in any case   you still take your baby       i dont know how long the baby will stay calm       u might have to walk out with an crying baby in between the movie         u can always watch a movie at the comfort of your home anytime      ,1
my 18 month baby having green poop   wid mucus since morning 6 times what to do friends what can b d reason,0
salaam momies  meri beti gir gai thi 3 4 days phele us tym sahe thi bx thora roi thi lkn aj mene dkha halka sa nil pr gya h aur wo jaga andr sa moti ho ri ha cheeks pr hoa ha kia kro k wo thk ho jye,0
there are other products in market specifically for new borns   try them like moms co     donum these are totally toxin free products,1
hello mommies  any good homeopathic doctor in south delhi for kids  thanks in advance,1
u can use lactare granule        2 spoon with glass of milk in 2 or 3 time as ur need          its not harmful          nd use lots of jeera nd methi in food          drink los of water            milk me sabse jyada pani hi hota he,0
my seven months baby is having loose motion since 6 days     took him to pedia     his medicines are also going on     but his motion is not stopping only     ,0
hello everyone after delivery muje 1 year k bad periods aye nd tb sahi aye lkin eske bad ab ek din b ni chle bht kam bs   is there any problem   ,1
meri 4n half years kia beti h   use two days loose motion h   use oflox syrup or darolac pouch diya h   but abhi thik nahi h kya karu,0
hi  my baby   8 month   is not drinking water from last two days until she drank well   i m giving her by spoon nowadays   i tried with different flavors   do u have any idea that she starts drinking water  ,0
hi plz suggest me how to make homemade kajal     my daughter is 7 month old,1
same prblm dear mene to ab har man li wo piti hi nhi he kya kru,0
my daughter some times rub her nose    when she was hungry     i think these is not worried,0
meri baby 1 year ki ho jayegi abhi wo kuch dino se kuch nhi khaa rhi h sirf breast milk le rhi h kya kru     ,0
while feeding my breast pains very much   any remedy to cure the pain   ,1
hi mera beta 6 months ka hai or uske teeth are hai to uske taalu me desi ghee lgake use garam rakhe ya thanda rkhna hai koi kehta h thanda rkho koi kehta h ki garam rkho desi ghee lga k,0
what are the best books for 6 months baby for bed time  ,0
choose healthy and natural foods at 6 months of age   please avoid any refined food stuff    ,1
hi all    before period im having fever  vertigo and low bp from last 5months wat s the reason behind this  i consulted many doctors but no use so pls give me suggestions thanks in advance,1
hi   my baby is 15months old    i am feeding till now but my weight is reducing day by day and becoming lean     to increase the weight what shall i do   can you plz suggest me   ,1
when we should give cow milk our baby  ,0
feeling frustrated and sad        dont know how and what i need to do to make my baby eat at least little food        my baby is 1 year 10 days old since 3 days not eating anything even fruitsjuice only she want my milk        any solution please      ,1
please go to the doctor,0
4 month ki h baby      mai deti hu letke      but ab suna h bche ka ear behne lag jata h peek se      kya sch h  ,0
isnt it true mommies       even if all we did today was play and spend time  with our kiddos and helped them become better human beings      thats really something special   ,1
hi momz    plz suggest    i dnt hve steamer so i just boil apple and blend it    iz it ok    plz plz tel,1
c section ke bad jo belt use ki jati h kis naam se mile lower abdomen ke liy,0
hi mommies within how hours formula milk can consume for baby any suggestions plzz,1
meri normal hua hai fir v back shoulder   spinal cord   tail bone   legs sab jagah pain hota hai   pata nai kb thik hoga     doctor ne calcium ka dose badha diya mujhe,0
hi all   mera beta 2  5 yrs ka hai lekin kaju badam bilkul nahi khata   usko kaise du  ,0
meri baby 5 month ki h phle m usko uper ka milk deti thi tb y daily poti krti thi phir maine uper ka milk bnd kr dus toh ab y 2 3 dun m ek bar port jati h     kya y problem h koi     pls suggest  my baby is 5 months ago   i used to give her milk   then i used to have a lot of milk   then i can stop my milk   what is the port of 2 days   is there any problem     plus suggest    rate this translation,1
maine to 4th month se start kia tha,0
hii ladies   mera 8 months baby doodh bahut palat ta h please sugg  me kya kru,1
